{
  "schema_version": "0.1",
  "id": "work-demo-login-validation-001",
  "goal": "Reject an empty username before the login request is sent.",
  "requested_by": "demo-user",
  "resources": [
    {
      "id": "resource-demo-repository",
      "kind": "git-repository",
      "locator": "examples/demo-login-app",
      "allowed_actions": [
        "read",
        "edit",
        "run-focused-tests"
      ],
      "revision": "demo-base-revision"
    }
  ],
  "acceptance": [
    {
      "id": "criterion-empty-username",
      "statement": "An empty username is rejected before a login request is sent.",
      "required_evidence_kinds": [
        "test-result"
      ],
      "evidence_ids": [
        "evidence-focused-tests"
      ],
      "status": "passed",
      "verified_by": "independent-acceptor"
    },
    {
      "id": "criterion-existing-valid-login",
      "statement": "A valid username can still proceed through the existing login flow.",
      "required_evidence_kinds": [
        "test-result"
      ],
      "evidence_ids": [
        "evidence-focused-tests"
      ],
      "status": "passed",
      "verified_by": "independent-acceptor"
    },
    {
      "id": "criterion-scope",
      "statement": "Every changed path is within the authorized resource scope.",
      "required_evidence_kinds": [
        "scope-check"
      ],
      "evidence_ids": [
        "evidence-authorized-diff"
      ],
      "status": "passed",
      "verified_by": "independent-acceptor"
    }
  ],
  "risk": "low",
  "risk_reasons": [
    "The example uses a local, disposable repository.",
    "The authorization excludes external side effects."
  ],
  "prohibited_actions": [
    "network",
    "deploy",
    "change-outside-resource"
  ],
  "status": "accepted",
  "plan": [
    {
      "id": "step-inspect",
      "summary": "Inspect the current validation and focused tests.",
      "status": "completed",
      "executor": "coding-agent"
    },
    {
      "id": "step-change",
      "summary": "Add the smallest empty-username validation change.",
      "status": "completed",
      "executor": "coding-agent"
    },
    {
      "id": "step-verify",
      "summary": "Run focused tests and inspect the authorized diff.",
      "status": "completed",
      "executor": "coding-agent"
    }
  ],
  "authorizations": [
    {
      "id": "auth-demo-write",
      "subject": "coding-agent",
      "resource_ids": [
        "resource-demo-repository"
      ],
      "actions": [
        "read",
        "edit",
        "run-focused-tests"
      ],
      "conditions": [],
      "expires_at": null,
      "granted_by": "demo-owner",
      "status": "granted",
      "parent_authorization_id": null,
      "granted_at": "2026-07-26T08:00:00Z"
    }
  ],
  "artifacts": [
    {
      "id": "artifact-focused-tests",
      "kind": "test-output",
      "uri": "evidence/focused-tests.txt",
      "revision": "demo-result-revision",
      "produced_by": "deterministic-verifier"
    },
    {
      "id": "artifact-demo-diff",
      "kind": "git-diff",
      "uri": "evidence/authorized-diff.txt",
      "revision": "demo-result-revision",
      "produced_by": "coding-agent"
    }
  ],
  "evidence": [
    {
      "id": "evidence-focused-tests",
      "kind": "test-result",
      "uri": "evidence/focused-tests.txt",
      "supports": [
        "criterion-empty-username",
        "criterion-existing-valid-login"
      ],
      "resource_revision": "demo-result-revision",
      "collected_by": "deterministic-verifier",
      "observed_at": "2026-07-26T08:00:00Z",
      "details": {
        "exit_code": 0
      }
    },
    {
      "id": "evidence-authorized-diff",
      "kind": "scope-check",
      "uri": "evidence/authorized-diff.txt",
      "supports": [
        "criterion-scope"
      ],
      "resource_revision": "demo-result-revision",
      "collected_by": "deterministic-verifier",
      "observed_at": "2026-07-26T08:01:00Z",
      "details": {
        "outside_scope_paths": []
      }
    }
  ],
  "executor_ids": [
    "coding-agent"
  ],
  "next_action": null,
  "revision": 8,
  "created_at": "2026-07-26T07:55:00Z",
  "updated_at": "2026-07-26T08:02:00Z"
}
